Number,Comments
1,"All this place does is double the price of Amazon products. I use the shop app which tells me who fulfils the order and yep, I can see that it ships straight from Amazon. I went onto amazon and searched and found the exact same jackets that I ordered from Angel Jackets but for HALF the price that Angel Jackets is selling them for. And on top of that, Angel Jackets charges a restocking fee - which Amazon does not! And you also have to pay return shipping. I really wish I had noticed this before ordering from Angel Jackets. I feel so ripped off right now."
2,"The jacket purchased for my husband fits perfectly, couldn’t be happier and I do intend to be a repeat customer. Highly recommend Angel Jackets. Customer service was spot on as we were asked if we were purchasing the correct size .. we were and we did!!"
3,"I received my order from Angel Jackets and have to say I was totally happy with my purchase. The quality and craftsmanship of my jacket is excellent. Soft, comfortable,  well made and at a very fair price. I’ll definitely buy again from this retailer."
4,"I'm a new customer but am so impressed with the service and quality of the products sold, l have bought 3 jackets in the last few months. Whatever issues may arise, Angeljackets resolve them in an efficient and timely manner."
5,"It is greatI ordered a leather jacked. I ordered a large, then I received an email asking me to take some measurements before I placed my order. I took thosemeasurements and then ordered an extra large. It fit perfectly when I got it. Thanks for the extra email."
6,"I am so excited about my new leather jacket! The style and fit are exactly as described. I considered ordering a size up, based on a few reviews, but was glad that I did not as it fits true to size. There was an unpleasant odour when I first unpacked it, but after a few hours it had aired out and now smells like fresh leather. I love it!"
7,"I am wowed by the value of my jacket. The attractive yet suspiciously low price had me questioning the jacket’s quality.but after studying Angel Jacket’s return policy and following their detailed sizing guide, I was reassured that ordering this jacket online was not risky. I am ecstatic with my purchase. The fit and the soft quality leather satisfies me 100%. This was a five star purchase."
8,"I did a search for a leather jacket. After spending some time searching, I was taken by the look and styles of the jackets sold by this company. I found what I was looking for and was lucky that they had a promotion to go with it. The follow up emails were prompt and informative. The shipping was quick and free. Upon receiving my jacket, I was pleasantly surprised that the quality was excellent, and the color as shown in the ad. I highly recommend you take a look at their site."
9,"I tried to purchase a leather Jacket (UK) via paypal -3 Inst. Then I received a message saying that the purchase will be complete once the whole amount is received (which is going to be three months later when it won't be needed anymore). I have tried to contact the customer care twice to cancel the order as Paypal suggested. No response. I don't know the quality of the jackets, but your customer care doesn't match the quality to satisfy a customer. Customer care should not be provided only if you purchase something. For sure you have lost one even before I buy anything."
10,"Have to admit I was a little wary of ordering from Angel Jackets, as was unfamiliar with the company... but SO glad I did! The entire experience was easy, my orders (I made two separate ones because I was so pleased with my original order) were delivered quickly. The jackets I received were beautiful- the quality is top notch, the attention to detail is great. The sizing chart is accurate. I couldn't be happier with every aspect of dealing with Angel Jackets. Highly recommend."
11,"Awesome blazer! Received a lot of compliments on it. Nice fit, beautiful black color, thick yet soft leather, totally clean, no odors, and came with original tags, great piece. Had some delays with shipping my order, but this doesn't seem to be representative of their usual service. The customer support team responds quickly. Overall, I highly recommend it :)"
12,"I really like this jacket. Fits snug,but that is what I wanted, I ordered a medium and it fits good. The jacket needs to get broken in. However, once that happens this will be an excellent jacket I give it 5 out of 5 star"
13,"I totally loved the style of my jacket and the feel of the leather!So Fashionable and sophisticated, yet light in weight. I couldn't resist getting one for my husband, he received it yesterday and he is sooo thrilled about it, perfect fit and sits well on his 6ft + frame!"
14,"Delivery was quick for me, had no issues there. Ordered the wrong size but they have been very helpful with the exchange process. The quality of the jacket felt high standard."
15,A trustworthy company with quality merchandise. Keeps you informed and delivers fast. I am very happy with my purchase.
16,Good quality jacket true to size. Kept informed from order to delivery and arrived in good time.Lovely jacket have had lots of compliments. Would recommend.
17,"Best customer service, super fast post, value for money Tuxedo, I ordered the wrong size pants, they bent over backwards for me to help. They sent a second pair, faster post than the first. This has been the best experience of have had with a web based company in many years. Highly recommend them as a AAA+++ business."
18,Excellent communication and service. Jacket arrived within 5 days of international order. High quality; couldn't be more pleased
19,I ordered a cognac brown jacket and it has just arrived. I can honestly say I was nervous opening it because I thought it was going to be too good to be true!!! The customer service has been brilliant from day one and it has reached me in a really timely manner as well. The jacket is a gorgeous waxy brown cognac colour and seems to be very well finished. It is slightly thinner (and therefore lighter) than a cow leather jacket I own but this is lambskin which will be perfect for spring and autumn. I am honestly stoked! Also pls follow the measurements online. They’re pretty spot on.5 stars guys. Now I only wish you had some other colours like deep inky blues and greens.
20,"I highly recommend this company. My jacket is beautiful, well made and a great price. The good were shipped straight away and arrived promptly. I’m so happy with my purchase!"
21,Great products!Great price!Great service!Great online and product return policy!...and that's from a Man United Fan buying in the old enemy territory!
22,Amazing service!!Quick response really catered to my needs beautiful pieces went out of their way to help me.Definately will be a customer again!G x
23,"Shoes came very fast and was in great condition, just discovered the shop too looking for some designer sale and Common Projects!"
24,"I love their products, they are beautiful, fast delivery and comfortable to wear"
25,"I've shopped online with Union22 several times over the years.  Even for online, you get a very personal service, quick email comms and handwritten thank you notes added to your package, for example. They also have one of the best collections of brands in the country. Would love to visit the shop one of these days! Highly recommended!"
26,Great store for mens clothes and the latest sunglasses with exceptional service from Dale. International delivery to UAE took 2 days 👌
27,Shipment was very quick and quality of clothes are extraordinary.I had tiny issue but they fixed it quickly and the communication with Dale was very smooth.Will visit the store to thank you when I have a chance!
28,The whole shopping experience from choosing the items to delivery was very efficient and professional. The items are as advertised and excellent quality. I would highly recommend this retailer
29,Best quality and the whole process from buying to shipping was sooo fast😊😊
30,Excellent service great quality clothes fast delivery and packaged with a touch of luxury.
31,Good information and pictures of the trainers. Shipping was fast. That's why I'm a regular shopper from Union22.
32,Been buying all my clothes from Dale for over 5 years now He’s the most honest guy I know and nothings to much trouble he goes the extra mile for his customers he’s a true gent and has a good eye for up and coming trends and fashion houses check this guy out he’s the business 😃👍
33,Every time I use Union22 I’m blown away. The combination of incredibly low prices and a truly personal service is for me the best online shopping experience out there. I love the fact that they are a small business and that they are clear about their terms: both aspects make me really trust them.
34,"High quality, perfect garments at a very competitive price. Quick, efficient service. Thank you"
35,Received my order withinTwo days after the order was placed ..I have been ordering from Union 22for four years and never been dissatisfied they are very professional and always go to there website first to make a purchase .The item came wonderfully wrapped .5* is not enough for this review ..Raj
36,Very good service from these guys. Have used them before and will shop there again. Some fine clothes on sale as well.
37,Picked up a bargain in the sale. Dale discovered the size was out of stock but he did a solid by contacting the designer and getting hold of the size I ordered. Don’t know of any other retailer who would do this! 10/10.
38,"Usually shop Hugo Boss, Reiss etc but I feel the quality from these mid range designer outlets as dipped, it's took a while to find a company that sells quality with a great attitude to customer care and service, finally found Union 22.My first order was a pair of Tramarossa jeans pricey at £275 (normally would pay up to £150 for jeans) but the quality and fit was there to see, and hopefully they will stand the test of time."
39,"It has been a great pleasure to purchase from Union 22 with the very personal touch of Mr Dale Allman who replies immediately through an email. and even goes out of his way  to search for items from Sweden. We have purchased a lot in the past and will continue to do so even if the items are not in his website anymore.  THANK YOU MR DALE ALMAN!  WITH ALL THE BEST WISHES FROM Perth, Western Australia.. WE HOPE TO MEET YOU IN PERSON SOON JUST TO EXPRESS OUR GRATITUDE AND CONTINUE TO DO BUSINESS WITH YOU. > Rose of Oz."
40,"I like looking dapper and stylish actually. I always strive to gather sights from the mass when I am going somewhere or just walking around the town. I dunno know, mb these are traits of a true narcissist but it doesn't really matter for me. What matters is that this company offers a huge collection of various suits, costumes, shirts, tee's, sweatshirts and hoodies. I always buy here the attire as I want to look fresh nearly daily. I am quite  a smart man and I sold my old clothes and buy a new one. It's so kind of shopaholism =) So, I would highly recommend this store for all the men who want to look gorgeous and handsome."
41,"The order confirmation email was sent right after the order was placed. A shipping notification email with a tracking link was sent to me when the package was shipped out. Properly packaged with a paper wrap, bubble wraps, and my receipt with a handwritten note. My package was delivered by UPS. The package was received within 7 days and was delayed over a weekend due to weather conditions which is understandable. The product was as described and photographed on their website. I didn't need to return anything, thus can't commend their return process. Overall, a nice shopping experience, and I will shop with A.K. Rikk's again."
42,"The site is very good, they made my dream come true - I bought myself a new computer. They have profitable mining, fast payouts and other benefits. Reliable company, you can trust them, have a company certificate, responsive support, etc. Made $3,000 from this site in 12 months.  Environmental company using alternative energy. All the best of great income and health!"
43,"As always A.K. Rikks goes above and beyond! Whether ordering online or shopping in the store, the staff exemplifies all the best traits that go into great customer service.  Once you shop here you become a part of the ""tribe"".  Great selection from a variety of brands that are not found elsewhere in Grand Rapids. Thank you!"
44,"AK Rikks has some of the best if not THE best customer service I’ve ever experienced anywhere.  When the sale promo code did not work for me because the sale had just ended, AK Rikks texted me my own personal code and they honored the sale price and they couldn’t have been nicer and more friendly.  I got my package in two days with a little personalized note on the receipt.  It was a nice touch.  I really can’t recommend this place enough.  Greg"
45,"Website was spot on when ordering, item shipped faster then expected. Packaging was great & item was just as described. First time purchasing with you & look forward to again. Thank u :)"
46,"I like buying clothes. Every season I got to the mall or clothing store in order to buy new clothes for the new season. I prefer wearing t's, trousers or jeans and I have plenty of shoe pairs. However, recently, unfortunately, my favorite clothing store was closed because of the restrictions accepted due to coronavirus, I started to search for another clothign store, where I could uy new clothes. Fortunately, I found this comapny and after I explored the assortment presented here I ordered couple of t's and a sweatshirt. Everything was delivered in time and I am glad that I applied here."
47,I had  such an excellent experience with A.K.Ricks. I made a purchase but unfortunately it was out of stock. I was contacted immediately and reassured that the item would be sent to as soon as it is available. A few week later I received my item in one of the best packaging I have ever seen. I recommend this store 100%.
48,"I have never experienced a more attentive ""online"" store. The people at AK Rikk's are exceptional with their customer service, and the product selection is outstanding. I will definitely continue to shop this store, despite being almost a thousand miles away."
49,"Shoes came very fast and was in great condition, just discovered the shop too looking for some designer sale and Common Projects!"
50,Love your store! Got my husband a beautiful wool coat from your 90% off sale. It was on my doorstep two days later! Fast and great service!
51,"It was myfirst purchase on this website. The shipping was very fast and the communication was great. Unfortunately I live in France so the shipping was more complicated and long but the seller offer a great solution to ship in my country. The handbag is very beautiful and flawless, well packed and it came with an invoice. It was a great first experience and for sure I will order other items !"
52,"With my new sneakers, the package is really nice and beautiful. It was an excellent purchase at an excellent price. I can't say enough good things about this place: quick shipment, well-packaged items, and a personal thank you message."
53,The best customer service there is! I found a hell of a deal on a loafer that was in the warehouse and after placing my order online I started to question if the 11 was the right size.  I called in to ask if someone could grab both the 11 and 12 from the warehouse was assured it was not a problem at all.  I came in the next day and sure enough the 11 fit but the 12 was there just in case.  Great experience as always.
54,"Really lovely and luxurious packaging with my new shoes. It would have been great if they offered some type of promo code for first time buyers from the website, but I understand not all retailers off this. Otherwise really wonderful service."
55,"AK Rikks is a trusted source for men's and women's apparel. I have ordered a number of items from them over the last few years for my wife and I and the product always shows up well packaged with a quick delivery. If it doesn't fit, you can easily return for a refund."
56,"Exceptional service even from an online experience. Great selection of must have items, and they have fast shipping. I will definitely be a repeat customer."
57,"Fast shipping, great customer support , and when I received my package it even include a hand written note thanking me for the purchase! Overall very good experience and would shop here ahain"
58,Sweet price on the shirt I wanted plus fee and fast shipping. That's about as good as it gets.Kudos!Chris Gibson
59,I cannot tell you how much I appreciated your personal customer service. I love your flannel box packaging as well. You worked as an incredible team to send a present overnight to my dear friend in England. She was thrilled. Forget 5 stars! A full sky of stars would not be enough! Thank you!!
60,"AK RIKK's is amazing! They retroactively applied a missing 20% coupon that saved me a ton of money, they shipped quickly and swiftly in an amazing box, and the return policy was perfect in giving me peace of mind. I will definitely be using AK RIKK's as a go-to."
61,"First time buying from here so I ordered a few $80 hoodies.. Got no confirmation, the money came right out of my account so I emailed them to ask what's going on so it's been 4 days and no response and no way to contact them any other way! So now I gotta call my bank and tell them it was fraud and get my money back."
62,"For this is the best Clothing Store for men, high quality product, smooth transaction and fast delivery"
63,Spent over a $100 on t-shirts and a Hoodie. Washed it once picture faded and streak lines of picture cracking.
64,I first Purchased close from y’all last year. I loved everything I got and I can say in just a years time the quality and material has gotten even better and great fit. I even needed a refund for a wrong size and it was sent over the very next day.
65,Didn’t give me an option on free shipping and ended up paying for priority shipping and still took about 3 weeks to receive the items. Will not order from here again.
66,"My boyfriend bought our daughter a tshirt and matching sweats about 2 years ago. She wore it several times so it’s been washed. Same outfit on my 2 year old yesterday. The fabric is the same, the color isn’t faded. I love it."
67,I’ve always loved hasta muerte clothing and I recently made a purchase on some hoodies and shirts and I loved it more i am definitely buying more really good quality
68,"For my first purchase ever from Hasta Muerte, I chose the $100 mystery box and I just gotta say- worth every penny I spent on it 🤩 my daughter stole one of the hoodies before I even got a chance to wear it 🤣😭 but I’m definitely going to be a customer “Hasta Muerte” 💯"
69,"Amazing brand, beautiful quality, and a price that makes the items feel quality, fire 🔥"
70,Favorite Online Streetwear Brand I’ve found! I came across Hastamuerte and have been nothing but satisfied with the product quality and style. Their constant releases and variety of items keep me coming back and wanting to buy more. There’s no other brand like this one and I’ll continue to support because of the great customer service!
71,I ordered 3 T-shirts. Products were delivered a few days late.  Quality was average
72,"I’ve purchased clothing from Hastamuerte numerous times and their product is high quality at all times. Never had any issues with shipping or anything. I love the products and I’m a supporter of their brand. Keep up the good work, it’s a appreciated."
73,I don't typically write reviews but I felt compelled to do so with this one. If I could give customer service 10 stars I absolutely would! Ordered a t shirt and it was just a bit defective from processing or whatever. I emailed support about the issue they got back to me very quickly and agreed to replace the item without hesitation. The quality of the product is great so totally looking forward to receiving my new one! What a great company with outstanding service!!!
74,These shirts are some of the best I've personally bought online or in store .just so well done perfect feel ....just quality overall definitely worth the wait and price .
75,"I ordered a ""trust noone"" face mask, when I got it, I noticed a seam coming apart, so I sent them a pic. They replaced the mask for free and allowed me to keep the other, no questions asked. Was a breathe of fresh air to be treated as human with an issue that could be solved simply. Very appreciative of the treatment and plan on buying more products."
76,Best clothing company on the market! Made of great quality always delivers even when they’re late they send updates an offer to make it right to keep you posted.When the quality isn’t the best they know they need to upgrade and they do it I’ve never been let down and everywhere I go people see the clothing and they complement it! 12 out of 10
77,Love the products. Best styling in the industry by far. Always exceptional service and quality is always on point. And if anything ever does happen (which is rare) the customer service is amazing. They work with you and make it right. Very smooth experience overall. I will definitely be a life long customer and continue to show my support. Love everyone at the company. Show your support you won’t be disappointed 💯
78,I love you guys...your clothing is SO DAMN DOPE.  I wore the 2 hoodies I bought from your site...as well as the shirts I received from you.  My wife bought me a cold bucks T shirt for my birthday at hibbetts...which I was shocked that they carried your clothing.  I wore that shirt with my UNC JORDAN 3s and some jeans...perfect fit for the day.  Keep up the great work...you know I am definitely a fan of your clothing.
79,"Hasta Muerte hands down the best qualityproducts on the market. Products fit wonderfully and perfect for any occasion. I am 14 shirts in and still get compliments in public. Great brand not only for the amazing quality, but the excellent customer service!"
80,"Lol I see they pay for people to write reviews. I ordered product on the 13th, it’s the 23rd and it hasn’t been shipped. Even though I paid $21 for priority shipping the is supposed to come to my house in 4 business days. They emailed me they are like 8 days behind filling orders so a couple of y’all are lying on here. Won’t give me my priority shipping fee back. Never order from here they suck."
81,"Otrium is a year-around gem to have; I’ve stopped shopping with my regular brands and I’m spending all my time and money shopping at Otrium building my forever, timeless, dream wardrobe. I have to dress for four seasons, so there’s always something “l need”! :-)"
82,Excellent experience ordered items and received everything in a timely manner it was well worth it
83,"I thought Otrium was too good to be true.  How could prices be so great?  I turned to Trustpilot for reassurance and went ahead and ordered (a lot).  Every item was perfectly packaged; every item was new; free delivery was fast; returns free, as well.  What's not to love?"
84,Excellent seller. Fast shipping and order processing. I am satisfied with the product. Everything corresponds to the description and photo.
85,Nice clothing deals. Exceptional service and shipping speeds. Items were packaged professionally.
86,"Very easy to buy, the order was fast. Previously, one of the items needed to be returned and it was also easy and fast."
87,"I've become a (too) regular shopper on the Otrium site and I couldn't choose a better company to buy from.  Their customer service aims to please, their sales are generous and frequent enough, and there's always FREE SHIPPING! Hope as it gets more popular that the things I've come to love about it stay the same. Highly recommend!"
88,"I randomly found this site while searching for a pair of Alala leggings and couldn't believe my eyes when I found them at 60% off! I immediately started perusing the site and ended up buying 5 things for less than $250. Everything was over 50% off and such great brands and selections. I sent it to all of my friends and they are now obsessed too. I just placed my 3rd order since discovering it a week ago. Magical but incredibly dangerous! Free returns, free shipping, i mean, it's like a sustainable version of amazon for amazing brands. LOVE IT!"
89,"First time customer for the website.  I’m usually very cautious when it comes to online shopping.  After reading the reviews and checked out the merchandise,  then decided to pull the trigger and made a purchase.  Then I got an email stated that order will be delayed.  Oh oh.  I thought it’s not good!  Did I made a right decision to purchase from this website?  Thought maybe it’s not a reliable website.  I do have to say that this is a legit website with genuine merchandise.  The shipment delivered within time!  I made a second order soon after.  Great merchant!"
90,"This site has all my favorite brands! Especially The Flexx and Faherty! Also a new favorite, Outerknown. I love that these brands are sustainable.  That’s important to me. The prices are amazing! With any online shopping returns are a Necessary evil. Thanks Otrium for including a return slip and label to make this part a breeze. And returns are free!! I’ll definitely be using and raving about Otrium for the future!"
91,"Ordered several items from them, arrived as described.  Service was expedient, received the order within 3 days.  Very happy with the purchases"
