Number,Comments
276,I sent you guys an email about my order and how I could not apply my 20% discount and haven't heard anything from y'all.
277,Logan's of Lexington went above and beyond.  I ordered the wrong size and they were able to get me the correct size in time for the Holidays!
278,I had a bit of trouble ordering a gift certificate on line. Mead a quick call and they helped me right away. They were a pleasure to deal with.
279,Impressive quality product and great shipping and delivery followup I have not experienced with product shipping before 10/10!
280,"The packaging, communication and the product itself, was fantastic. Thank you! My husband is going to love it!"
281,"HOLY MOLY! I'M IMPRESSED, I bought the suit and had my feelings about the website thinking it was a fake website with fake reviews but NOPE! My suit came in and it was BEAUTIFUL! I mean it fit good and all! Will definitely buy another👍"
282,"I have been buying from Suit Outlet for more than 5 years.  Most of my wardrobe was purchased here. I have been as heavy as 386 lbs and always found quality and comfortable suits.  I am really happy because I have lost over 100 lbs and find more selections available.  As a plus size it's hard to find fashionable clothing that don't make you look like wearing a tent.  Again, I always found quality and look good!"
283,I have always worn suits. My boys are suit wearing young men. With the cost of everything rising I have been looking for good quality suits at a reasonable price. I ordered 3 for myself first. All fit great and look even better. I just ordered my boys at least 2 suits each. The sizing was off on one of my sons as he is a slim Jim. Exchange was no problem. Thanks so much for your care of we the customer. I will be back and I have told others about Suit Outlet.com
284,"always on time, great quality!!"
285,This brand was so amazing for me I'm very satisfied with their quality. I would definitely use them again!
286,I have been buying suits from Suits Outlets and I like the quality of the suits that I have purchased and looking forward to purchase more real soon..
287,"To Suit Outlet,Your response time was excellent. You were able to resolve my issue within a timely Manner. I truly appreciate being a customer.I have already placed a new order and I anticipate making many more purchases.Thank you,Donald K."
288,I was happy with my product very easy to order and the price was a plus! Shipping surprised me how fast I  received my suit! Thank you so much I will definitely buy from you again
289,"This is my third purchase from Suits Outlets, I have been very please with their custom service and suits I have purchase. Good quality and style at reasonable prices.  Good Job Suits Outlets, you have my business!"
290,"very quick service on line , also i called to get some sizes clearance and i was very satisfyed too."
291,I am always very satisfied with my product and service with suits outlets the product is always represented accurately and honestly what you see is what you get and you get what you pay for and I am and always will be very pleased and satisfied with my product and with the service from suits outlets
292,"I have been waiting for this suit for over 6 months, & once it came back in stock, I was notified right away. That is great customer service."
293,"So far so great! Mr Jim has been most helpful when ordering & making an even exchange for my husband's suits. I ordered 3 thus far. The suits are very stylish, yet very reasonably priced. My husband wears his suits a lot. I just ordered him one for his up & coming birthday. Hoping he loves the color as much as the style.😊but do much thanks to Mr. Jim, gir his welcoming & helping spirit made my return for purchase more highly likely. Thank you Mr. Jim"
294,"The initial transaction was wonderful. However, I had to return because I ordered the wrong size. Subsequent transactions were not as good. Turn around and shipping the second time was slow. In addition, I placed an order for a second suit. Response and shipping time for the second suit was also slow. Suits, however, are great!"
295,I would have given five stars but several suits I wanted were not in stock and I was unable to submit my email to be contacted when the suits would be back in stock. This will be my go-to for suits in the future and I highly recommend you give them a try. I'm confident you will not be disappointed.
296,"Everything was very easy going in placing my order but there's is one of concern. When I wanted make a correction on my order I was unable to through your(Chat or call your1888-909-0748). So I would appreciate if you all would correct my address correction. The Correct address is 236 Oglethorpe street, Northeast, Washington, D.C. NOT NORTHWEST."
297,"Ordered two walking suit, package arrived today with invoice for the two sets but only one set uin package.  Called number on the email I had received when order was placed.  Call went to voice mail, I have made several orders from this site without problem but now that this has happened I am upset and is hoping this is an error which will be corrected."
298,"The fit, finish and Affordability of this suit is amazing, I couldn’t believe it was real. I’m  ecstatic about the results of my  purchase. Not only will I recommend Suits Outlets Club to my friends and family, I’ve gone back to order more of their  apparel, thanks guys, it’s what I’ve been looking for, great clothes at a fair price."
299,"A beautiful suit, however it doesn't fit despite is having the same dimensions as clothes I wear everyday. This company's measurements are a bit skewed, so you need to order a suit larger than your measurements."
300,"Cannot objectively make a decision as I was trying to order from Bachrach and am not sure if this is the right place or not.  I will be happy to make a review once items are received.  Loved the accessibility of the site, very nice.  Thanks for the opportunity to use."
301,"UPDATE: Shuuk contacted me directly after my feedback, they were very helpful and responsive.  I appreciated their help.  Also, their returns and refund process was very fast and easy. PREVIOUS: I am a first time customer. After I placed my order, I got a post-purchase offer for an extra 12% off the shoulder bag from my order. I thought it was a discount in addition to the item already in my order, but it added a SECOND bag to the order as a separate purchase. It’s a bad and confusing user experience for the website to offer a post-purchase item at a discount for the exact same item that was already part of my order.  I did not want to have my credit card charged for both items, when I thought I was just ordering one."
302,"All my expectations were met. Fast delivery, quality products, and great customer service. Will definitely order from Shuuk again."
303,"This was my first order and did have something mis-ship.  Although they were slow to respond from my initial email request for help, four days later they fixed it quickly and all I had to do was drop it off at a FedEx store for an instant credit.  My replacement was at my house within three days and gorgeous.  All the items were so cute.  I already have another cart going."
304,I ordered two casual blouses.  Both  were nice and fit perfectly.  I received my order  in a timely  fashion.
305,"I'm from Uruguay and live in the United States; I learned about Shuuk through emails from the Uruguay Consulate.I decided to give Shuuk a shot, and I'm really impressed with the high quality of their clothing, products, services, and shipping.Two products were sold out, and my credit card was immediately refunded.FedEx delivered my order two days later.You've got a lifetime customer here.Thank you so much!!!"
306,I have a great time with customer service I will keep you as a great value.
307,The crossbody I ordered on here is cute! Such a perfect size and style for any type of event :)
308,"I bought 2 dresses. 1 I love and it is just what I was looking for. The other is such a strange material, like a cross between a swimsuit material and polyester. The print is less appealing on that fabric and all of the stitching is visible."
309,"I have never ordered from this company before, but there was a shirt I was very interested in, so I purchased it. The item was received promptly and I was very pleased that it was exactly what I saw in the picture and read in the description I am very pleased with my purchase and will consider ordering again from Shuuk."
310,I have yet to order from this and the website came up in an add. And I didn’t think it was legit until I saw these reviews saying it’s amazing quality. I am so excited to place the order soon. As well the prices are amazing. I think getting my package will feel like Christmas. I’m so excited
311,"A great shopping experience, as usual.  Your sales are amazing.  Thanks."
312,Quick shipping from Uruguay! Way better than some companies shipping within the U.S. I'm very happy with the clothes I received especially the sale prices. Really nice quality and the fit is perfect!
313,Delivery took 2 weeks and when the dress arrived it is way too small.I’m a 12 but ordered a 14 to wear loose yet I can’t even get it on.Also much lighter in colour.Can’t bothered to send back and keep track of refund so will put in the charity shop.
314,I absolutely love this company. Everything is excellent quality and the fit is spot on. Shipping to UK is unbelievably quick. I would totally recommend this company. Would give 10 stars
315,The quality of the clothes is really great for the price. Love the colors. The delivery is fast and exchanges and returns are smooth and hassle free. Would definitely recommend Shuuk to my friends.
316,Love the Lolita line of clothing  and can’t wait to try the other lines .  Amazing shipping too!
317,"I am not happy at all with the service I received from this company. I sent them several emails asking them to  provide me with the Royal Mail return label, in order to return the 3 shirts because they are very large. Unfortunately, they are ignoring my emails. Here is my order Number SK5399. Could you please send me the Royal Mail label so that I can return the shirts ?"
318,"The clothing items are great quality and are exactly as described on the webpage. Shipping was super fast and came earlier than expected. Return Policy is amazing. Free returns, no questions asked!"
319,my name maria i am very happy with this story my favorite thing is shopping and i like the clothes everything i like i shop a lot
320,"Great crinkle fabric shirts, I love the texture of the material!!"
321,Prompt response in less than 48 hours for an exchange in size. Turn around from the time I mailed the product and received the proper size in a week. Looking forward to my next purchase.Ronald Lewis
322,"I am very happy with this company.  This is my second purchase, these people are very responsive and their products are quality.  Their leather is imazing.  I had to switch an item and it was done right away and with ease. Overall I am very happy with their service"
323,"Bought this jacket and what an incredible piece!  Great quality.  The leather is soft and luxurious and has no odor.  The styling is really unusual and super flattering.  To find your size, use the size chart.  I love this jacket....will definitely buy another style or color!"
324,I love this jacket. I've been looking for a signature leather jacket that doesn't break the bank. And Fan Jackets delivered. This American product is well made and designed. I'm shaped like a rectangle and this peplum asymmetrical jacket gives me an allusion of an hour glass figure. I can't wait until it's cold enough to wear it. THANK YOU!!!
325,"Excellent quality jackets. Clearly real leather as they have that nice smell to them and are very soft. The sizing estimate was perfect too, which was a relief. I'm almost sad it's summer as I want to wear it right now everywhere, but at least I'm set up for autumn now. Great company, shop with confidence!"
326,"Our experience with a return went effortlessly smooth. Fans Jackets made sure that we were satisfied customers, no additional fees, and a customer service representative that exclusively worked with us throughout the entire transaction. Fans Jackets will always be our go to store for quality products, and customer service !  Thank You All !!"
327,Bought for my Twd Negan outfit but has become my go to jacket. Exactly like the jacket Negan wears from The Walking Dead and is comfy to wear aswell as feeling and looking as high quality as promised would definitely recommend.
328,The coat was very good quality. The only problem was that the sleeves were not wide enough for my fat arms. The return process was quick and easy as long as you follow all the rules.
329,This jacket is not only beautiful it's comfortable and practical. The zip out hood is soft and perfect for rain or snowfall. This jacket hugs your curves while also providing adequate room in the breast area. I would highly recommend for anyone who wants utility and beauty together in a gorgeous soft leather jacket!
330,Peplum jacket was beautifully made. Soft supple leather. Fit was spot on using their quide. Packed nicely and arrived sooner then expected. Highly worth the purchase.
331,"I recently purchased some beautiful leather driving gloves and I am so happy! The leather is soft, supple, and high quality. I read many other reviews that recommended buying a size smaller than normal since the gloves run large and I am glad I took that advice. I will definitely be ordering From this shop again."
332,I loved the jacket. It fits well and I can move around it easily. I'm 5.7 and usually wear XL. I bought an XL leather jacket. I can zip it all the way up and still have room to move freely. But for me another size up would have given me extra comfort. I would like to add the shipping time didn't take long either.
333,The leather jacket I purchase was true to size I follow the recommendations Fan jacket shared with me and I like the fit. the smell of leather still remain on it even after 3 weeks of wear. and for the price and discount you can't go wrong. Delivery wasn't long but its worth the wait. Just make sure you put all the information correctly. Much appreciated stay safe all.
334,I have purchased four jackets (leather and lambskin) from Fan Jackets. My last jacket arrived in a shedded package and the internal jacket packaging was bent. I inspected the jacket and there was no damage. I took photos and sent them to Fan Jackets for their review. I will continue to purchase from Fan Jackets as the quality and pricing of their jackets are great.
335,"I order the men's rip black cotton trucker jacket in a xl which is my normal size ,but I  had to return it as it fit a little tight , Jasper was great in customer service and they shipped out my 2xl right away and I  received it within 5 days and it fits prefect , I am very happy with the jacket but I would suggest to order it in a size up. thanks again for the great customer service Fanjackets !!"
336,"My experience ordering from your company was exceptional. Your app., made the fitting of my size very easy, my order was shipped quickly and the fit and quality of the jacket was outstanding. I thank you and your team for a job well done. I look forward to doing more business with your company in the near future."
337,"I ordered the wrong size. Even after checking the sizing charts I wasn't sure since I had recently lost weight.The exchange was painless and way better than expected. I received a response within 24 hours, the return label arrived and the exchange was fast and without any additional cost. I also received a discount code for my next purchase! The Jacket I received is top quality, and I'm very happy with it. Great communication and a great company to do business with."
338,"I bought a beautiful white coat in medium.  Should have bought a small but will get alterations.  Just for reference I am 5'2' 115 but with a 36 "" chest so that why I purchased medium.  So look at the way the coat is made to see if you should size up..normally I do size up but this time I should have sized down.  I have bought from Fan Jackets several times know and loved all of purchases."
339,Great experience! I will be using this company again.   This was a Christmas gift that I ordered early because I didn’t know if I had the right size. Upon getting it my friend lovvvvved the jacket but did need a different size.  The return was so easy and they sent a new jacket as soon as they got the old one back.  It was quite fast.  My person loves the jacket and the quality is great.  It even has the hoodie that was a must!
340,"we purchaced a leather blazer, to replace ours that got misplaced, we asked them if we ordered one if it didn,t fit would they supply return label they agreed, so we took a chance were we don,t buy cloths on line, we got the jacket fit perfect nice leather it was about the same as our 30 year old one had all the inside pockets like our original  over satisfied with- don,t be scared when ordering, you should be happy donny"
341,"The design of MINOAR's clothing impresses in photographs, and thankfully the material and workmanship more than satisfies in person as well. Their customer service is excellent, giving fast and very personal feedback and assistance. Since it can be such a gamble, I typically hesitate to purchase clothing online. I am glad to took the risk with MINOAR, and if you find yourself enjoying their aesthetic, I highly recommend you give them a chance."
342,"I have ordered several times from Minor.Love the design, quality and service.Feels like wearing an unique clothes"
343,"My experience with Minoar was very good , professional team, professional service, unique exceptional personalized items , the quality they provide is amazing! I purchased two cardigans and two pants and was very satisfied of my choice. I will surely do it again. FOR THE ONE WHO DOES NOT BELONG . Good work Minoar team . God bless 🙏🏻"
344,"Anxiously awaited my first order from Minoar - the Duality Skirt - after seeing various OOTD from a TikTok content creator who raved about Minoar. Totally understand why - WOW!  The skirt is gorgeous! So well made and material is so luxurious! Unlike any cotton I’ve ever experienced - almost like suede! Even unpackaging was an experience! The skirt was wrapped so beautifully in a cloth pouch and came with a personalized note… it’s the little details for me! 🤌🏽🤌🏽Was sad that skirt was too big and I couldn’t wear immediately! (ordered a large but runs a little big maybe ?? I and 5’2, 155#, apple shaped) -  But even Minoar’s Customer service was impeccable; prompt response and easy exchange!! Love it! Wish all online retailers were like this!! Will DEFINITELY be shopping Minoar again 🖤🖤🖤PS: if you’re concerned about pricing - just know that these items are truly impressive, well made, classic pieces that will likely withstand time if cared for properly!! And anyways fast fashion may be cheap but it sucks and doesn’t last!"
345,"Minoar has been one of my favorite brands to shop with for years now. Every order is well packaged and organized. Their return and exchange processes are very streamlined, their customer service representatives are kind and quick to respond, and their prices are more than reasonable for the quality you're receiving. Cannot recommend them enough!"
346,"Great clothes, fun designs, good quality fabric.Being an online website, its hard to gauge what fits and doesnt. I selected xl on every item and sizes were inconsistent upon reception.But overall, shipping was fast, no issues, customer service was helpful and handled size exchange quickly. Strong recommend."
347,"Nice clothes, nice store, nice customer service! Will be coming back!"
348,"Minoar is the kind of experience you hope for as a traveler and explorer, especially when that exploration goes beyond the immediate surroundings and way into the realm of ideas, approaches and philosophies. Minoar is a unique place. I will always treasure my experience of discovering the store and meeting the brilliant minds behind it. A rare place that allows you to discover bits of yourself by exploring theirs."
349,Not only is Minoars clothing uniquely cool it’s well-made too Staff are quick to respond to emails In a super professional friendly manor Definitely a customer for life Fred j
350,"Its the best community . You can always ask for a question or something about the things you want to know and they will be there for you. The quality is non other than perfect the designs are out of this world and you can be sure that it wont change it'll get even better because they care about the things ,every small detail . Dont hesitate and order free you wont be disappointed. Trust the MINOAR family."
351,"I’m so glad my boyfriend found this website and sent me a link to one of the skirts I ended up buying. I was searching for modular, dystopian skirts for a couple of weeks and these are exactly that! I love both of the skirts I got because — they’re unique. It’s so hard to find modular clothing on the market, especially fully adjustable pieces like this. Plus the silhouette is sick! Some things they could improve on are smoothness of the skirts (maybe a soft thin lining to enhance comfortability?) + more skirts AND pants/shorts available in white :)"
352,"My experiences with the Atelier has been stellar, with my latest order being the cherry on top. Will stick around this brand for a long long time 🔥"
353,"Service client fantastic, team adorable (Yoan, Tea, Alek, Radko and the rest of the team), I would like to thank again an amazing experience into the Minoar atmosphere I found myself more and more into their conception of the dark wear, which I spent a lot of time on the phone with them, it's priceless.Their garments it made with love and care is not like any clothing I could find in a different independent brand, this is the little difference change everything like the internal pocket cut in diagonal, it needs to think about this,  especially their signature the fiber bond technique is unique another avant-garde.Keep working hard team :)"
354,Minoar has been my go-to designer since 2017.   The customer service and quality of the clothing is exquisite.
355,"This company makes apparel outside of the high speed fashion industry, creating garments that will last and make lasting impressions whenever, wherever, and however you wear them.I started building a Minor wardrobe many years ago now, and I still love all the pieces I own. My most recent purchase was an Aspect face mask, it's such a great piece of headwear, unlike anything I've seen before. It's stunning!The company is run by passionate people who really interact with their clients, they are responsive and happy to help whenever you reach out. The handling of an order is swift, almost all my orders have arrived within a week (International shipping). Far quicker than what you normally expect when ordering anything really."
356,"Amazing quality, design and reliable service!This is a brand that will become a fashion powerhouse in Europe, the quality is 5 stars and the originality is out of this world!"
357,"Minoár is a dream come true for men and artists who always struggled to find original design clothes at affordable price. I ordered several pieces of clothing from them and always had excellent experience: these folks never disappoint! Shipping is free & light-speed fast, usually takes 2-3 days max across countries. Quality from materials, to style and packaging is top-notch. Appearance is even better than what advertised on-site, their clothes make you stand out from the crowd without being over-the-top. Several friends already asked where do I get all these cool top-wears from. Last but not least, their customer service responds in minutes and takes excellent care of your issues. I've always hated writing review, and yet - this avant-garde brand deserves some solid kudos. Rock on!"
358,"I placed my order on Tuesday, and it arrived that Friday. From halfway across the world! I love the book, and I’m definitely making a purchase here again!"
359,"Love your style, the items come in a nice pouch, i will definitely come back for more!"
360,Superb quality and fantastic service (e.g. quick shipment turnaround).
361,I browse the internet to find some new cloth. I suddenly see their advertisement. I click the website and see the dress. its quality is just awesome. I highly recommended to my friend and family to visit this store when they come to this country.
362,"I bought a jacket with $25 off as a promotion. Turns out I needed a size up. Rather than chance missing out on the next size up as part of the return/exchange process, I just bought it. And then sent the smaller size back for a refund. Four issues. 1) I lost the $25 off in the process 2) the jacket had tailor’s chalk near the buttonholes 3) I had to pay for returning it 4) the larger size jacket did not include a storage bag. It is a high quality jacket, but the experience was mundane."
363,"The super fast shipping makes buying over the web from Haspel faster and less time consuming, where I live, than getting into the car, battling traffic, and finding out the store has a limited selection of the seersucker I want. Too bad I don't live in New Orleans"
364,I am very happy with my white linen jacket. Very well made and fit perfectly...something not always the case when ordered online. I had to replace another white linen jacket that had been damaged (from a different supplier). The Haspel jacket was a better design and came in a very timely manner.
