Number,Comments
92,Otrium is one of the better sample sale sites out there. They do not have a time limit and so it’s a better shopping experience. I have made 5 purchases so far and have only made one return. Unlike sample sales their return policy is top notch (free returns).
93,"I love using this site. The options and the selections are great.. The sizing is a bit confusing because many of the articles come from different countries that use different scales that used different scales for sizing. That presents a problem for me being American and us having a fairly standard set of sizes. Other than that I'm very happy with the site. I'm happy with the delivery, it's very fast. The discounts are deep and the quality of the products is very high. I highly recommend Otrium  to anyone!"
94,Awesome prices on awesome products; super fast shipping; I highly recommend this online store!
95,"I ordered an item and then the system canceled it and returned the money automatically. I really wanted the order so I contacted Otrium help center. Anna answered and gave me a free shipping discount, but when I told her that I can no longer find my desired item she apologized and gave me an additional 15% discount.She was very nice to me and also this was not the first time I talked to her. She was always very helpful, prompt and also very kind.I would definitely recommend Otrium.com!!! Excellent service and attitude towards customers."
96,"This place is great since the product selection, fair prices and customer service. I had a small issue with the product I received - the clasp wasn’t working properly - and their customer service blew my mind. It was so so good! They most definitely have my business."
97,I’m in love with the top. The price was amazing and I did not see this item available on other websites. Shipping was fast and easy. I will definitely shop again.
98,"Amazing Belstaff merchandise at the fraction of what it would cost elsewhere, I’m in love with my new jacket. Two beautiful linen jumpsuits from Faherty were a steal as well. Items ship almost immediately and are at my front door within 3 days on average. Highly recommend this company, I have already been recommending them to all of my friends"
99,I love that My items were shipped immediately.
100,I order from Otrium often. The prices are amazing and the returns are free. My Belstaff collection is wonderful thanks to Otrium!
101,"Great service.  Shipping was quicker than stated, and communication was great.  Price was the best I had seen on these, including, in Hawaii!"
102,I initally gave a 5 Star review but this rating system is to difficult so I chaged it to worst rating
103,I loved the shoes and am pleased with the packaging and shipping as well. Thank you!
104,Great kilt hangers. Nice darkly stained hardwood. Four sturdy metal clips that are enameled won't cause any damage to my kilts. The kilts hang very flat and level with these to maintain pleats. I recommend these.
105,They advertise the wrong color for their golden brown timberland pro boots. Aka they lie to their customers. Extremely disappointed.
106,"Easy, quick, fast loved my item and loved the quick shipping"
107,"The Dansko clogs & sandals are perfect but for some reason were shipped to CA before coming to FL? Am error on shippers part, obviously, but they took 2 weeks to get to me. Longest I have ever waited for an order from lebos."
108,This was my first time ordering from Lebo's and it was a GOOD experience. My shoes shipped to me pretty quickly and were in Great Shape. The quality of the shoes is really GOOD also. Thanks for a good experience Lebo's.
109,"I just discovered Lebos in North Carolina. I placed an order for a pair of clogs and within a few days I had them delivered to my home in TN. Unfortunately they didn't fit, so I sent them back. Within a day of reaching them they sent an email that my account has been credited already. That is what I say is good customer service. Now looking forward to visiting their western ware store. My husband wears those cowboy hats so it sounds like a great store for both of us."
110,"Received two Breyer Romero, just like I ordered. But they were just wrapped in the plastic shipping bag. Both models boxes were damaged! So a little disappointed they would shipped not in box. But looks like model look ok!"
111,"I was searching on the web for Carolina on my mind Bogg bag. The color was a bit hard to find. I came across Lebos and not only did they have the color,they had large and baby. So I order both. Came in a few days and the packaging was perfect!! I have no complaints"
112,Bought some sandals and they are perfect. Fast shipping and great customer service too.
113,Wonderful first experience with Lebo's! I ordered my granddaughter's dance shoes. They arrived in a very timely manner. I was updated in email with the shipment progress. The selection is great!
114,"since I live in VA and on border of Kingsport TN, these shoes came FAST! I see that you are located in NC. These white flatfoot shoes without taps were delivered in my mailbox. Excelllent quality, just what I was looking for. These are hard to find..I thank you tarheels!"
115,I’ve been looking for the Hey Dude’s Wendy’s white crochet shoes in a size 7 for quite some time. Lebo’s had them in stock whereas nobody else did. They shipped them in record speed and with absolutely no problems. Will definitely be doing business with them again! Wish we had Lebo store near us!
116,"I recently just learned of Lebos from my daughter in law. I bought 2 pairs of Hey Dudes. I wasn’t sure of the sizing, I normally wear a 7.5, somewhere I read to go up a size, so I bought the 8. Unfortunately they were too big. Lebos made exchanging them for a size 7 so easy and they shipped extremely fast!  I love my shoes and will definitely buy from Lebos again!"
117,Ordered pair of shoes from their website and they were awesome! A friend of mine recommended them and it was no mistake to submit an order. I will definitely recommend them to more people!
118,Somehow I accidentally ordered the waterproof version of these but ended up loving them. Quick shipping and solid communication from Lebos regarding shipping. Will definitely buy from them again.
119,"I couldn’t have asked for anything better. Web site was easy to order from, delivery was very fast as promised. Extremely satisfied!"
120,"After paying $139.99 for a pair of the Dansko Pace Ladies shoes and wearing them on a few times indoors only, the glued on treads on the bottom of the sole of the shoes are coming off!  Bad design and poor quality."
121,Love my new alpaca wool scarf. Got exactly what I was looking for. It was easy to place my order and it was ready to be sent out the same day and received it in 2 days. Thank you!
122,The Peaky Blinders hat is good-looking and the XL fits very well.  Hats are true to size.  My wife loves it on me!  I love the extended bill.  The shipping time was fantastic.  The hat came in just a few days.  Overall a great experience.  I will order more hats from this provider.
123,"Although I haven't received my order yet, the process of shopping online and ordering was pleasant and straightforward. I look forward to wearing my items when they arrive."
124,"I love my cap with the Celtic Dog on it. However, I wish the design would have chosen some more contrasting color for the embroidery"
125,"the quality of this clothing is impeccable!  I have been looking for new Irish linen cap for a while now, I have a black and natural color caps from my visits to the Emerald Isle . The two i purchased from Celtic Clothing were beautiful and different shades of green. I will enjoy them next spring and summer. But the weather is changing in the Pocono Mts. in PA so i will wear my wool caps from Muckros and Hannah hats from Eire, San agus Beannacht;"
126,"I purchased the ladies wool wrap, it feels soft and durable. It will be a versatile piece as I often find coats too bulky to wear. As a suggestion, in the online catalog listing of clothing I’d like to see more views (front, back, side) of the items."
127,Using the website was easy and informative. I have not received the items yet but the turn around time from order to shipping was less than 1 day. Celtic Clothing is an outstanding shop to shop with.
128,"I have bought several items from Celtic Clothing over the years. The merchandise is high-quality, reasonably priced and always arrives promptly. I will buy from them again, and I would recommend them highly to anybody looking for clothing and accessories that are made in Ireland."
129,I found the shopping experience quite pleasant and efficient. The tracking technology was more than helpful. I will gladly purchase more products in the future.
130,I ordered a green knit sweater of Irish wool. It arrived very quickly and in great shape. It is a typical well made
131,The package was delivered in a timely manner. The shirt is a very nice quality and fit is true to size.
132,"Charles and his staff working the Dublin, Ohio Irish Festival went above and beyond to help me find just the right rugby shirt and cap that I wanted. Everyone's customer service and friendliness were top notch. I'm very satisfied with my purchases, and I will buy again. Thank you, sláinte!"
133,This company is great! My item was on back order but when it shipped it came two day priority mail which I thought was above and beyond. The sweater is incredibly beautiful and excellent quality. I am happy.
134,"Exactly as described.  Very fast shipping. Good, quality clothing. Thanks"
135,"Very Quick delivery and good quality T shirts at very good pricing. Always easy to select items on the website. EXCEPT: Would be 5 stars except for the very annoying Captcha buttons and its picture games for account login and for PayPal. I already gave you my account password and my PW for Pay Pal, so get rid of the redundant Captcha buttons. Quite Annoying. Thanks."
136,I was a little apprehensive at first given I ordered a tweed cap. I have experience with wool berets and they are not comfortable at all haha however this cap is simply stunning. Amazing fit. True to size great fabric feel and quality. 10/10
137,"I would have given 5 stars, but they are not what I expected. I have purchased grandfather shirts elsewhere. I thought these would be a little lighter weight, for summer. They are wearable in summer, but a little on the warmer/heavier side. Still, good shirts for a good price."
138,Please list size dimensions for vests in inches measuring length/chest/and waist.  The vest dimensions do not match shirt dimensions. I selected a 2XL vest based on 2XL shirt sizes I purchased through your store. The vest was not as large as the shirt I bought. I paid shipping out of my pocket expense to return the vest. The additional information will be very helpful. Quality product otherwise.
139,I had a minor issue with my order and they communicated well during the process and made it right. I recommend them and would purchase from them again without reservations.
140,Ordered linen cap.  Arrived timely and in good shape.  Appears to be of very good quality.  It is lightweight which is ideal for hot weather.
141,I use this platform evrytime I have in mind something I need and it never fails to find something that suits my needs for me this is the best website for people.
142,"Very good store with ideal stuff. But sometimes my order is delay. Nevertheless, I like to use this service"
143,"I am highly recommend this store, very good quality and excellent attitude to the customers"
144,Excellent Product of excellent Quality provide with an  excellent Service ... meaning that my Experience ( not the First-One ) ... is still excellent.Good Job Guys .. you made me proud again to wear a USA Kilt
145,"Excellent customer service. I accidentally ordered two shirts twice. They took the time to call me to see if I really wanted the extra order. You can’t beat that. Looking forward to seeing my husband’s kilt, it should be coming soon. Great videos too, we have learned a lot."
146,"These shirts of which I now have 3! Fit the bill well for Mass , a night out with a casual yet gentleman apparel !  Work well with both Kilt & jeans ,"
147,"USA Kilts is an outstanding organization, from top to bottom, with excellent customer service, a high-quality product, and superb educational tools. I am a cancer patient and am unable to wear pants due to radiation burns. USA Kilts accelerated their production process in order to outfit me with a gorgeous kilt and accessories when I needed them the most. Having a background in marketing and sales, I cannot speak highly enough of their trained staff and knowledge of their product. After researching possible kilt sources, I was blessed to have discovered USA Kilts and not fall for the knock-off kilts from Pakistan. I am now a new and faithful customer, having made additional purchases to expand my regalia. Kudos and thank you to USA Kilts!"
148,"I have been asking numerous questions about kilts, proper attire, etc. My questions are answered promptly and courteously. Never a ""canned"" response. My most recent question was about the placement of the sporran chain. Gillian, especially, has been wonderful about giving me clear responses and direction. That is representative of what USAKilts is all about."
149,"I bought a casual kilt called The American Heritage kilt. It is more than I expected! The quality of material used to the craftsmanship and how the kilt was made is more then I could hope for. Yes it took a while to receive the kilt, but it was much sooner then I was quoted. When I put the kilt on I was doubtful that I took my measurements correctly, but it fit perfectly!! It's nice to know that there is a company out there that still puts quality first. This company has my business for life."
150,USA Kilts never disappoints!  Love my minis for playing pipes on stage with Live Wire! And my trad and semi trad kilts for everything else.  Thanks for keeping me looking good doing what I do! Loyal repeat customer!
151,Great kilt hangers. Nice darkly stained hardwood. Four sturdy metal clips that are enameled won't cause any damage to my kilts. The kilts hang very flat and level with these to maintain pleats. I recommend these.
152,"Excellent quality of products and they are exactly as described on website.  The order was shipped  safely in a timely manner and emails kept us updated along the way.  This is our ""go to"" company from now on."
153,I was very pleased with the pleasant personality and knowledge of the young lady I spoke to regarding the gift I bought from my daughter's 25th anniversary she was thrilled and her husband thank you for such a speedy service
154,"My second casual kilt from USA Kilts. The Celtic Nations tartan was designed by a genius, the colors seem to go with any hose or shirt. Fit is perfect and the lighter weight material just feels right. I paid for RUSH service and got it in 11 days. Note I have been wearing kilts for over 30 years, I love this one!"
155,"@ last minute, I ordered a gift card for my brother for his birthday. The site stated immediate delivery. After 2 hours my brother had not received it. I sent an email and within minutes I had received a personal email with an apology. My brother received a personal email with a link and attachment for his card. PERFECT! I since have received another email with the reassurance that it wouldn't happen again and the issue would be resolved. No complaints. Highest respect for this company."
156,"The customer service was second to none. When my order got delayed in shipping they overnighted a whole other rental package just to make sure my wedding day would be everything I imagined it would be, and it was. I cannot speak more highly of this company, their professinalism, and the speed at which they assisted me, and specifically Heather for her kindness and excelllent customer service through all of the issues I experienced."
157,"Rock solid customer service. Ordered a jacket/vest combo: jacket fit perfectly, vest was a bit snug. Two emails and 4 business days later, I had the new vest in hand and I'm ready for my wedding anniversary with a week to spare. The fine folks at USA Kilts have their act together."
158,"Amazing quality, answers calls and emails promptly and they have amazing customer service skills. Very willing to help with anything and everything and answer questions. My wedding is coming up and my fiancé bought his Prince Charlie set from them- jacket was small and they did the exchange in days and expedited the shipping! Totally worth the price tag because you're paying for quality materials and service!"
159,"As a gift for my 60th birthday, my wife gifted me a great kilt package from usa kilts, and I have absolutely nothing but the very best things to say about them and their products! Everything that arrived was of top-shelf quality, their service was timely, products reasonably priced, and the people I interacted with during the process were all wonderful! They haven't seen the last of me!"
160,"I am just becoming a serial kilter. I have a heavier, ""nicer"" kilt that I got myself for my wedding (My dress cost more than my wife's), but I am looking for something to be an everyday knock-about casual kilt. The people at USA Kilts have been very helpful and patient helping me get up to speed about the various options available to me. This order was just for some swatches, but the customer service has been out of this world!"
161,"After searching online for a pair of Royal Robbins shorts, I finally found the color and size I needed at New Horizons Trading. Customer service was excellent. They confirmed the item was in stock and double checked on the shipping address. Shipping was quick and efficient. I am very happy with the purchase I made and would highly recommend this company."
162,Got my shoes quickly and they were good quality
163,"Service was outstanding! I ordered online, but had a minor problem with my address. I phoned the store and they were great! Outstanding people. Thank you all!"
164,I received my order very quickly from New Horizons Trading. Package arrived within a few days and was packed very nicely with a personal touch. There was a hand-written card inside thanking me for my order. Great customer service for an online purchase. I will definitely order from this company again!!
165,New Horizons was great.  They had exactly what I wanted for a great price and got it out to me quickly. Literally could not ask for better service.
166,The sun hat and shorts are high quality and should last a long time. The items were thoughtfully packaged and included a small gift for my daughter with a hand written thank you note for shopping small. The little touches combined with great products makes New Horizons a win win!
167,"Pleasant surprise with New Horizons Trading, found what I wanted at the best price and had my order within a couple days.  With that order came a for real handwritten thank you note with a 10% discount code.  So I went ahead and got my wife some boots that she needed and they arrived just as promptly.  You never know what an experience will be like ordering from a new place, but this is a gem.  I’ll be a return customer for sure!Ira G."
168,I searched Keen on FB for wet shoes for my daughter size 6.5 and I picked your store. I was treated well on the chat with the lady and I received shipment that was well wrapped and a personal thank you note from Mary for shopping with New Horizons. I would recommend shopping here. I’m not sure which store it came from as I’m not at home with the box it came in. Thank you
169,"New Horizons Trading in Downtown Pittsboro is my ""go to,"" ""gotta see what's new"" clothing store.  I always find interesting, comfortable and fun clothes, shoes and gifts there. The staff are friendly and always willing to help but will also let you browse to your hearts content without bothering you.  I love to visit anytime I'm in the neighborhood."
170,"I love the staff and both the New Horizons stores equally! And now, online ordering with parking lot pick up….. doesn’t get much better. We are so grateful and fortunate to have these folks in our community. Awesome selections, great sales, and superior customer service. Woo-hoo! T Ladd Pittsboro, NC"
171,"Way more than you might expect to find. This is a fabulous gift shop and women’s clothing store in downtown Pittsboro. I always find something I like here: funny oven mitts, dish towels, and socks, candles, wind chimes, jewelry, soaps, skin care, baby items, high end shoes and bags, and beautiful unique clothing. The staff is truly helpful and they don’t hover. Awesome sales too - like 40-50% off shoes. I challenge you to choose a gift and card for a friend’s birthday and NOT buy something for yourself too. LOL!"
172,"I have always had such a great experience at both New Horizons Downtown and New Horizons West. They have very unique gifts, shoes, clothes, camping gear and accessories at both stores. The employees are very friendly and helpful to everyone. I highly recommend that you check out these stores."
173,"Everytime I say to someone, ""you must go to New Horizons,"" they are thrilled to have visited the stores. It was one of three local businesses that I chose to support by buying a gift certificate at the beginning at the pandemic.  Wonderful staff, great merchandise, all around wonderful!"
174,"I love these shoes; however, I wear them out quickly and this style has been discontinued. I was pleased to have found a pair online at New Horizons for a low price. They arrived quickly and should give me another 6 months of happy feet on my daily walks! Thanks."
175,"Unlike other platforms, it is quite comfy, and the designs are distinctive. I have no concerns and am satisfied with the services provided.It's simple to place an order, and the merchandise arrives quickly."
176,This is a great shop. Everyone is always very helpful but not overbearing. I am always impressed by the the shoe selection. It seems they have a better selection than some shoe stores. The clothes sre great also with a great selection of not run of the mill merchandise..
177,Awesome service!!!Love what I ordered and although I had an issue with shipping. Liz was awesome at comunicating with me in tracking down my package and i finally received within a couple days of the mix up. I will definitely be doing business with New Horizon again!!!
178,"I love New Horizons, both stores!  I do a lot of Xmas gift shopping at the Downtown location.  And sometimes I splurge on something for myself from New Horizons West.  Staff at both stores are always helpful.  And the things they stock are so cool and interesting!"
179,"These guys are the absolute best. When we were planning a major trip to the Himalayas, they helped us stock up on lots of the things we needed, and ordered stuff they didn't have. I love them. Also they carry great shoes at the downtown spot."
180,"Love New Horizons!! I go there for my shoes, clothing, cards, camping and small gifts.  I’m native to Pittsboro but drive back from Durham to my shopping there.  They have all the best shoes for support which I need and looks.   The service and advice from their staff are great!! I call the New Horizons West my local REI for camping and outdoors wear.  The New Horizons downtown is my favorite for that special novelty gift and cards galore.  If you haven’t stopped by one of these stores, it is a must on Pittsboro and worth your drive!  Oh and yes they have awesome gift wrapped bags for those special presents. My favorite is the butterfly 🦋 paper."
181,"I can’t tell you how many compliments I have received from wearing all the jewelry I have invested in from this company. It truly is so magnetic to look at and people ask me all the time where I got my chains from. 10/10 recommend. I will be back for the rest. Also shoutout to Nelle, thank you for your superb customer service you made everything super easy. 👍"
182,"Every product I’ve ordered from JAXXON has been perfect! The 14K gold material looks stunning and has lasted almost two year so far! I’ve had a great experience with their customer service, and I recently talked to Ray, who helped me find what I needed!! I absolutely love this company and I hope one day they have a better variety of women’s jewelry."
183,"Their response time to getting back to you was far more impressive than I’ve seen from any other company. No lie. I received a 15% discount to use, however the expiration date to use the discount had passed. I figured I would reach out and see if they would honor the 15% for me. Not thinking I would get a reply anytime soon, I ended up getting a response in less than 10 min, with the discount being honored. Because of that quick response, and the discount (lol), I went and bought 2 silver chains. Very impressed! Thank you!"
184,"I had made a mistake while ordering my husbands gift for our wedding anniversary. I miss spelled my email and i noticed that i never received a receipt or a confirmation number. I emailed the company and expressed my concern and gave them my name, number, and my real email with no mistakes. Erly K was fantastic and sent me an email letting me know they are looking into it. Not long after i received another email with my receipt number and tracking for the necklace along with the estimated arrival date. Erly offered even more assistance if needed. I am truly impressed and appreciative of the communication."
